{
  "created_at": "2026-07-12T00:00:00Z",
  "mode": "fixture",
  "provenance": {
    "client": "FixtureLLMClient",
    "created_at": "2026-07-12T00:00:00Z",
    "mode": "fixture",
    "producer": "fixture",
    "run_id": "RUN-003",
    "schema_version": "2026-07-12.1",
    "source_artifact_ids": [
      "ART-001"
    ],
    "validation_status": "validated"
  },
  "run_id": "RUN-003",
  "schema_version": "2026-07-12.1",
  "state": "PATCH_PENDING",
  "updated_at": "2026-07-12T00:00:00Z"
}
